{
  "bridge_id": "aoa-tos-bridge-envelope-v1",
  "source_class": "tos_text",
  "source_inputs": [
    {
      "repo": "Tree-of-Sophia",
      "source_class": "tos_text",
      "role": "primary"
    },
    {
      "repo": "aoa-memo",
      "source_class": "memo_object",
      "role": "supporting"
    }
  ],
  "tos_refs": [
    "Tree-of-Sophia/ToS/doctrine/PRACTICE_BRANCH.md",
    "Tree-of-Sophia/ToS/doctrine/COUNTERPART_POLICY.md"
  ],
  "memory_refs": [
    "aoa-memo/mechanics/consumer-handoff/parts/kag-tos-bridge-handoff/examples/bridge.kag-lift.example.json",
    "aoa-memo/mechanics/consumer-handoff/parts/kag-tos-bridge-handoff/examples/memory_graph_face.bridge.example.json"
  ],
  "kag_lift_status": "candidate",
  "faces": {
    "retrieval_surface": "mechanics/boundary-bridge/parts/tos-retrieval-axis/examples/tos_retrieval_axis_surface.example.json",
    "chunk_face": "aoa-memo/mechanics/consumer-handoff/parts/kag-tos-bridge-handoff/examples/memory_chunk_face.bridge.example.json",
    "graph_face": "aoa-memo/mechanics/consumer-handoff/parts/kag-tos-bridge-handoff/examples/memory_graph_face.bridge.example.json"
  }
}
